{
  "artifact_version": "2.31",
  "registry_id": "v2.31_Public_BOIS_Common_Core_Permanent_Regression_Registry",
  "release_id": "v2.31_Public_BOIS_Common_Core",
  "status": "ACTIVE_PERMANENT_REGRESSION_CORPUS",
  "tests": [
    {
      "area": "PUBLIC_LINEAGE",
      "disposition": "REPAIRED_AND_REGRESSION_LOCKED",
      "evidence_ref": "validation/PREPACK_TEST_EXECUTION_RECEIPTS.jsonl#test_id=TEST-REGRESSION-F-001",
      "execution_status": "PASS",
      "expected_negative": "HOLD",
      "expected_repaired": "PASS",
      "finding_id": "F-001",
      "fixture_ref": "fixtures/REGRESSION_FIXTURES.json#/fixtures/F-001",
      "negative_fixture_ref": "fixtures/REGRESSION_FIXTURES.json#/fixtures/F-001/negative",
      "permanent": true,
      "repair_fixture_ref": "fixtures/REGRESSION_FIXTURES.json#/fixtures/F-001/repaired",
      "severity": "CRITICAL",
      "statement": "Public release identity, parent, compatibility, and semantic change map must be present.",
      "title": "Public release identity, parent, compatibility, and semantic change map must be present."
    },
    {
      "area": "AUTHOR_MESSAGE_BOUNDARY",
      "disposition": "ACCEPTED_ARCHITECTURAL_VARIANCE",
      "evidence_ref": "validation/PREPACK_TEST_EXECUTION_RECEIPTS.jsonl#test_id=TEST-REGRESSION-F-002",
      "execution_status": "PASS",
      "expected_negative": "HOLD",
      "expected_repaired": "PASS",
      "finding_id": "F-002",
      "fixture_ref": "fixtures/REGRESSION_FIXTURES.json#/fixtures/F-002",
      "negative_fixture_ref": "fixtures/REGRESSION_FIXTURES.json#/fixtures/F-002/negative",
      "permanent": true,
      "repair_fixture_ref": "fixtures/REGRESSION_FIXTURES.json#/fixtures/F-002/repaired",
      "severity": "ARCHITECTURAL_VARIANCE",
      "statement": "Mandatory delivery is retained, while the message remains non-normative and authority-neutral.",
      "title": "Mandatory delivery is retained, while the message remains non-normative and authority-neutral."
    },
    {
      "area": "SOURCE_PRECEDENCE",
      "disposition": "REPAIRED_AND_REGRESSION_LOCKED",
      "evidence_ref": "validation/PREPACK_TEST_EXECUTION_RECEIPTS.jsonl#test_id=TEST-REGRESSION-F-003",
      "execution_status": "PASS",
      "expected_negative": "HOLD",
      "expected_repaired": "PASS",
      "finding_id": "F-003",
      "fixture_ref": "fixtures/REGRESSION_FIXTURES.json#/fixtures/F-003",
      "negative_fixture_ref": "fixtures/REGRESSION_FIXTURES.json#/fixtures/F-003/negative",
      "permanent": true,
      "repair_fixture_ref": "fixtures/REGRESSION_FIXTURES.json#/fixtures/F-003/repaired",
      "severity": "CRITICAL",
      "statement": "Base invariants must precede operator decisions.",
      "title": "Base invariants must precede operator decisions."
    },
    {
      "area": "GATE_EXECUTABILITY",
      "disposition": "REPAIRED_AND_REGRESSION_LOCKED",
      "evidence_ref": "validation/PREPACK_TEST_EXECUTION_RECEIPTS.jsonl#test_id=TEST-REGRESSION-F-004",
      "execution_status": "PASS",
      "expected_negative": "HOLD",
      "expected_repaired": "PASS",
      "finding_id": "F-004",
      "fixture_ref": "fixtures/REGRESSION_FIXTURES.json#/fixtures/F-004",
      "negative_fixture_ref": "fixtures/REGRESSION_FIXTURES.json#/fixtures/F-004/negative",
      "permanent": true,
      "repair_fixture_ref": "fixtures/REGRESSION_FIXTURES.json#/fixtures/F-004/repaired",
      "severity": "CRITICAL",
      "statement": "Every C00-C11 gate requires typed input, predicate, evidence, fixtures, and executed outcome.",
      "title": "Every C00-C11 gate requires typed input, predicate, evidence, fixtures, and executed outcome."
    },
    {
      "area": "OBJECT_SCHEMA_CONFORMANCE",
      "disposition": "REPAIRED_AND_REGRESSION_LOCKED",
      "evidence_ref": "validation/PREPACK_TEST_EXECUTION_RECEIPTS.jsonl#test_id=TEST-REGRESSION-F-005",
      "execution_status": "PASS",
      "expected_negative": "HOLD",
      "expected_repaired": "PASS",
      "finding_id": "F-005",
      "fixture_ref": "fixtures/REGRESSION_FIXTURES.json#/fixtures/F-005",
      "negative_fixture_ref": "fixtures/REGRESSION_FIXTURES.json#/fixtures/F-005/negative",
      "permanent": true,
      "repair_fixture_ref": "fixtures/REGRESSION_FIXTURES.json#/fixtures/F-005/repaired",
      "severity": "CRITICAL",
      "statement": "Aliases, definitions, state enums, transitions, and required field types must resolve.",
      "title": "Aliases, definitions, state enums, transitions, and required field types must resolve."
    },
    {
      "area": "REFERENCE_CLOSURE",
      "disposition": "REPAIRED_AND_REGRESSION_LOCKED",
      "evidence_ref": "validation/PREPACK_TEST_EXECUTION_RECEIPTS.jsonl#test_id=TEST-REGRESSION-F-006",
      "execution_status": "PASS",
      "expected_negative": "HOLD",
      "expected_repaired": "PASS",
      "finding_id": "F-006",
      "fixture_ref": "fixtures/REGRESSION_FIXTURES.json#/fixtures/F-006",
      "negative_fixture_ref": "fixtures/REGRESSION_FIXTURES.json#/fixtures/F-006/negative",
      "permanent": true,
      "repair_fixture_ref": "fixtures/REGRESSION_FIXTURES.json#/fixtures/F-006/repaired",
      "severity": "CRITICAL",
      "statement": "Every declared file and JSON Pointer reference must resolve.",
      "title": "Every declared file and JSON Pointer reference must resolve."
    },
    {
      "area": "TEST_CONTRACT_COMPLETENESS",
      "disposition": "REPAIRED_AND_REGRESSION_LOCKED",
      "evidence_ref": "validation/PREPACK_TEST_EXECUTION_RECEIPTS.jsonl#test_id=TEST-REGRESSION-F-007",
      "execution_status": "PASS",
      "expected_negative": "HOLD",
      "expected_repaired": "PASS",
      "finding_id": "F-007",
      "fixture_ref": "fixtures/REGRESSION_FIXTURES.json#/fixtures/F-007",
      "negative_fixture_ref": "fixtures/REGRESSION_FIXTURES.json#/fixtures/F-007/negative",
      "permanent": true,
      "repair_fixture_ref": "fixtures/REGRESSION_FIXTURES.json#/fixtures/F-007/repaired",
      "severity": "CRITICAL",
      "statement": "Tests require inputs, operations, expected results, failure signals, repair routes, and evidence.",
      "title": "Tests require inputs, operations, expected results, failure signals, repair routes, and evidence."
    },
    {
      "area": "OPERATIONAL_SEMANTICS",
      "disposition": "REPAIRED_AND_REGRESSION_LOCKED",
      "evidence_ref": "validation/PREPACK_TEST_EXECUTION_RECEIPTS.jsonl#test_id=TEST-REGRESSION-F-008",
      "execution_status": "PASS",
      "expected_negative": "HOLD",
      "expected_repaired": "PASS",
      "finding_id": "F-008",
      "fixture_ref": "fixtures/REGRESSION_FIXTURES.json#/fixtures/F-008",
      "negative_fixture_ref": "fixtures/REGRESSION_FIXTURES.json#/fixtures/F-008/negative",
      "permanent": true,
      "repair_fixture_ref": "fixtures/REGRESSION_FIXTURES.json#/fixtures/F-008/repaired",
      "severity": "CRITICAL",
      "statement": "Missing paths remain UNKNOWN and HOLD outranks REQUIRE.",
      "title": "Missing paths remain UNKNOWN and HOLD outranks REQUIRE."
    },
    {
      "area": "VALIDATION_RECEIPT",
      "disposition": "REPAIRED_AND_REGRESSION_LOCKED",
      "evidence_ref": "validation/PREPACK_TEST_EXECUTION_RECEIPTS.jsonl#test_id=TEST-REGRESSION-F-009",
      "execution_status": "PASS",
      "expected_negative": "HOLD",
      "expected_repaired": "PASS",
      "finding_id": "F-009",
      "fixture_ref": "fixtures/REGRESSION_FIXTURES.json#/fixtures/F-009",
      "negative_fixture_ref": "fixtures/REGRESSION_FIXTURES.json#/fixtures/F-009/negative",
      "permanent": true,
      "repair_fixture_ref": "fixtures/REGRESSION_FIXTURES.json#/fixtures/F-009/repaired",
      "severity": "HIGH",
      "statement": "A semantic claim requires an executed receipt with validator identity and evidence.",
      "title": "A semantic claim requires an executed receipt with validator identity and evidence."
    },
    {
      "area": "CRITICAL_PREDICATES",
      "disposition": "REPAIRED_AND_REGRESSION_LOCKED",
      "evidence_ref": "validation/PREPACK_TEST_EXECUTION_RECEIPTS.jsonl#test_id=TEST-REGRESSION-F-010",
      "execution_status": "PASS",
      "expected_negative": "HOLD",
      "expected_repaired": "PASS",
      "finding_id": "F-010",
      "fixture_ref": "fixtures/REGRESSION_FIXTURES.json#/fixtures/F-010",
      "negative_fixture_ref": "fixtures/REGRESSION_FIXTURES.json#/fixtures/F-010/negative",
      "permanent": true,
      "repair_fixture_ref": "fixtures/REGRESSION_FIXTURES.json#/fixtures/F-010/repaired",
      "severity": "HIGH",
      "statement": "Critical applicability and violation predicates cannot be circular or uncomputed.",
      "title": "Critical applicability and violation predicates cannot be circular or uncomputed."
    },
    {
      "area": "JUSTIFICATION_GRAPH",
      "disposition": "REPAIRED_AND_REGRESSION_LOCKED",
      "evidence_ref": "validation/PREPACK_TEST_EXECUTION_RECEIPTS.jsonl#test_id=TEST-REGRESSION-F-011",
      "execution_status": "PASS",
      "expected_negative": "HOLD",
      "expected_repaired": "PASS",
      "finding_id": "F-011",
      "fixture_ref": "fixtures/REGRESSION_FIXTURES.json#/fixtures/F-011",
      "negative_fixture_ref": "fixtures/REGRESSION_FIXTURES.json#/fixtures/F-011/negative",
      "permanent": true,
      "repair_fixture_ref": "fixtures/REGRESSION_FIXTURES.json#/fixtures/F-011/repaired",
      "severity": "HIGH",
      "statement": "The philosophical justification graph must be present and reference active entities.",
      "title": "The philosophical justification graph must be present and reference active entities."
    },
    {
      "area": "RULE_STATE_AXES",
      "disposition": "REPAIRED_AND_REGRESSION_LOCKED",
      "evidence_ref": "validation/PREPACK_TEST_EXECUTION_RECEIPTS.jsonl#test_id=TEST-REGRESSION-F-012",
      "execution_status": "PASS",
      "expected_negative": "HOLD",
      "expected_repaired": "PASS",
      "finding_id": "F-012",